[
  {
    "id": "fiesta-de-bilbo",
    "date": {
      "year": 3001,
      "month": 9,
      "day": 22
    },
    "placeId": "bolson-cerrado",
    "title": "La fiesta de Bilbo",
    "summary": "Bilbo celebra su cumpleaños ciento once, desaparece ante los invitados y deja la Comarca. Frodo hereda Bolsón Cerrado y el Anillo.",
    "characterIds": ["bilbo", "frodo", "gandalf"],
    "ref": {
      "book": 1,
      "chapter": 1
    },
    "tags": ["comarca"]
  },
  {
    "id": "gandalf-vuelve-a-hobbiton",
    "date": {
      "year": 3018,
      "month": 4,
      "day": 12
    },
    "placeId": "bolson-cerrado",
    "title": "Gandalf vuelve a Bolsón Cerrado",
    "summary": "Gandalf regresa a la Comarca y confirma ante Frodo que su anillo es el Anillo Único.",
    "characterIds": ["gandalf", "frodo"],
    "ref": {
      "book": 1,
      "chapter": 2
    },
    "tags": ["anillo"]
  },
  {
    "id": "gollum-escapa",
    "date": {
      "year": 3018,
      "month": 6,
      "day": 20,
      "precision": "approx"
    },
    "placeId": "estancias-de-thranduil",
    "title": "Gollum escapa de los elfos",
    "summary": "Aprovechando un ataque de orcos, Gollum huye de la custodia de los elfos del Bosque Negro.",
    "characterIds": ["gollum"],
    "ref": {
      "appendix": "B"
    },
    "tags": ["gollum"]
  },
  {
    "id": "gandalf-y-radagast",
    "date": {
      "year": 3018,
      "special": "midyear"
    },
    "placeId": "vado-sarn",
    "title": "Gandalf se encuentra con Radagast",
    "summary": "Radagast le avisa de que los Nueve han salido y le transmite un recado de Saruman. El lugar exacto, en la frontera sur de la Comarca, es aproximado.",
    "characterIds": ["gandalf", "radagast"],
    "ref": {
      "book": 2,
      "chapter": 2
    },
    "tags": ["lugar-aproximado"]
  },
  {
    "id": "boromir-parte",
    "date": {
      "year": 3018,
      "month": 7,
      "day": 4
    },
    "placeId": "minas-tirith",
    "title": "Boromir parte hacia Imladris",
    "summary": "Tras un sueño enigmático, Boromir sale de Minas Tirith en busca de Imladris para pedir consejo.",
    "characterIds": ["boromir"],
    "ref": {
      "appendix": "B"
    }
  },
  {
    "id": "gandalf-preso",
    "date": {
      "year": 3018,
      "month": 7,
      "day": 10
    },
    "placeId": "isengard",
    "title": "Gandalf, preso en Orthanc",
    "summary": "Saruman se quita la máscara: quiere el Anillo para sí. Ante la negativa, encierra a Gandalf en lo alto de Orthanc.",
    "characterIds": ["gandalf", "saruman"],
    "ref": {
      "book": 2,
      "chapter": 2
    }
  },
  {
    "id": "gandalf-escapa",
    "date": {
      "year": 3018,
      "month": 9,
      "day": 18
    },
    "placeId": "isengard",
    "title": "Gwaihir rescata a Gandalf",
    "summary": "El águila Gwaihir recoge a Gandalf de la cima de Orthanc antes del alba. Ese mismo día los Jinetes Negros cruzan los Vados del Isen.",
    "characterIds": ["gandalf", "gwaihir"],
    "ref": {
      "book": 2,
      "chapter": 2
    },
    "tags": ["nazgul"]
  },
  {
    "id": "gandalf-en-edoras",
    "date": {
      "year": 3018,
      "month": 9,
      "day": 20
    },
    "placeId": "edoras",
    "title": "Gandalf en Edoras",
    "summary": "Théoden recibe de mala gana a Gandalf y le deja llevarse un caballo con tal de que se marche. Así encuentra a Sombragrís.",
    "characterIds": ["gandalf", "theoden"],
    "ref": {
      "book": 2,
      "chapter": 2
    }
  },
  {
    "id": "jinetes-en-vado-sarn",
    "date": {
      "year": 3018,
      "month": 9,
      "day": 22
    },
    "placeId": "vado-sarn",
    "title": "Los Jinetes en el Vado Sarn",
    "summary": "Los Jinetes Negros llegan al Vado Sarn al anochecer y ahuyentan a los montaraces que lo vigilaban.",
    "characterIds": [],
    "ref": {
      "appendix": "B"
    },
    "tags": ["nazgul"]
  },
  {
    "id": "jinete-en-hobbiton",
    "date": {
      "year": 3018,
      "month": 9,
      "day": 23
    },
    "placeId": "hobbiton",
    "title": "Un Jinete Negro pregunta por Bolsón",
    "summary": "Al caer la noche, un jinete encapuchado pregunta al Tío Gamyi por el señor Bolsón.",
    "characterIds": ["tio-gamyi"],
    "ref": {
      "book": 1,
      "chapter": 3
    },
    "tags": ["nazgul"]
  },
  {
    "id": "frodo-deja-bolson-cerrado",
    "date": {
      "year": 3018,
      "month": 9,
      "day": 23
    },
    "placeId": "bolson-cerrado",
    "title": "Frodo deja Bolsón Cerrado",
    "summary": "Frodo, Sam y Pippin salen a pie por la noche, camino de Los Gamos.",
    "characterIds": ["frodo", "sam", "pippin"],
    "ref": {
      "book": 1,
      "chapter": 3
    }
  },
  {
    "id": "encuentro-con-gildor",
    "date": {
      "year": 3018,
      "month": 9,
      "day": 24
    },
    "placeId": "bosque-cerrado",
    "title": "Encuentro con Gildor",
    "summary": "Una compañía de elfos ahuyenta a un Jinete y acoge a los hobbits esa noche en el bosque.",
    "characterIds": ["frodo", "sam", "pippin", "gildor"],
    "ref": {
      "book": 1,
      "chapter": 3
    }
  },
  {
    "id": "granja-de-maggot",
    "date": {
      "year": 3018,
      "month": 9,
      "day": 25
    },
    "placeId": "granja-de-maggot",
    "title": "En la granja de Maggot",
    "summary": "El granjero Maggot da de comer a los hobbits, cuenta que un Jinete ha preguntado por Frodo y los lleva en carro hasta la Balsadera.",
    "characterIds": ["frodo", "sam", "pippin", "granjero-maggot"],
    "ref": {
      "book": 1,
      "chapter": 4
    }
  },
  {
    "id": "balsadera",
    "date": {
      "year": 3018,
      "month": 9,
      "day": 25
    },
    "placeId": "balsadera-de-gamoburgo",
    "title": "La Balsadera de Gamoburgo",
    "summary": "Merry los espera en la orilla y cruzan el Brandivino justo antes de que llegue un Jinete.",
    "characterIds": ["frodo", "sam", "pippin", "merry"],
    "ref": {
      "book": 1,
      "chapter": 4
    }
  },
  {
    "id": "conspiracion-descubierta",
    "date": {
      "year": 3018,
      "month": 9,
      "day": 25
    },
    "placeId": "cricava",
    "title": "Conspiración desenmascarada",
    "summary": "En Cricava, Merry, Pippin y Sam confiesan que saben lo del Anillo y que irán con Frodo pase lo que pase.",
    "characterIds": ["frodo", "sam", "pippin", "merry", "fredegar-bolger"],
    "ref": {
      "book": 1,
      "chapter": 5
    }
  },
  {
    "id": "viejo-hombre-sauce",
    "date": {
      "year": 3018,
      "month": 9,
      "day": 26
    },
    "placeId": "viejo-hombre-sauce",
    "title": "El Viejo Hombre Sauce",
    "summary": "Un sauce encantado atrapa a Merry y a Pippin junto al Tornasauce; Tom Bombadil los libera con una canción.",
    "characterIds": ["frodo", "sam", "merry", "pippin", "tom-bombadil"],
    "ref": {
      "book": 1,
      "chapter": 6
    }
  },
  {
    "id": "casa-de-tom",
    "date": {
      "year": 3018,
      "month": 9,
      "day": 26
    },
    "placeId": "casa-de-tom-bombadil",
    "title": "En casa de Tom Bombadil",
    "summary": "Tom y Baya de Oro acogen a los hobbits dos noches. El Anillo no tiene ningún poder sobre Tom.",
    "characterIds": ["frodo", "sam", "merry", "pippin", "tom-bombadil", "baya-de-oro"],
    "ref": {
      "book": 1,
      "chapter": 7
    }
  },
  {
    "id": "tumulo",
    "date": {
      "year": 3018,
      "month": 9,
      "day": 28
    },
    "placeId": "tumulos",
    "title": "Niebla en las Quebradas",
    "summary": "Perdidos en la niebla, los hobbits caen en poder de un tumulario. Frodo llama a Tom, que los rescata y les da espadas antiguas.",
    "characterIds": ["frodo", "sam", "merry", "pippin", "tom-bombadil"],
    "ref": {
      "book": 1,
      "chapter": 8
    }
  },
  {
    "id": "poney-pisador",
    "date": {
      "year": 3018,
      "month": 9,
      "day": 29
    },
    "placeId": "bree",
    "title": "El Poney Pisador",
    "summary": "En la posada de Bree, Frodo se pone el Anillo por accidente y conoce a Trancos. Mantecona le entrega la carta retrasada de Gandalf.",
    "characterIds": ["frodo", "sam", "merry", "pippin", "aragorn", "cebadilla-mantecona"],
    "ref": {
      "book": 1,
      "chapter": 9
    }
  },
  {
    "id": "gandalf-visita-al-tio",
    "date": {
      "year": 3018,
      "month": 9,
      "day": 29
    },
    "placeId": "hobbiton",
    "title": "Gandalf visita al Tío",
    "summary": "Gandalf llega a Hobbiton y el Tío Gamyi le cuenta que Frodo ya se ha ido.",
    "characterIds": ["gandalf", "tio-gamyi"],
    "ref": {
      "appendix": "B"
    }
  },
  {
    "id": "asalto-a-cricava",
    "date": {
      "year": 3018,
      "month": 9,
      "day": 30
    },
    "placeId": "cricava",
    "title": "Asalto a Cricava",
    "summary": "Los Jinetes irrumpen de madrugada en Cricava; Fredegar Bolger escapa y da la alarma.",
    "characterIds": ["fredegar-bolger"],
    "ref": {
      "book": 1,
      "chapter": 11
    },
    "tags": ["nazgul"]
  },
  {
    "id": "salida-de-bree",
    "date": {
      "year": 3018,
      "month": 9,
      "day": 30
    },
    "placeId": "bree",
    "title": "Salida de Bree",
    "summary": "Tras el asalto nocturno a la posada, los hobbits salen de Bree guiados por Trancos y con un poni de carga.",
    "characterIds": ["frodo", "sam", "merry", "pippin", "aragorn"],
    "ref": {
      "book": 1,
      "chapter": 11
    }
  },
  {
    "id": "gandalf-en-la-cima",
    "date": {
      "year": 3018,
      "month": 10,
      "day": 3
    },
    "placeId": "cima-de-los-vientos",
    "title": "Gandalf atacado en la Cima",
    "summary": "Los Nueve cercan a Gandalf en la Cima de los Vientos; resiste la noche y escapa hacia el norte.",
    "characterIds": ["gandalf"],
    "ref": {
      "book": 2,
      "chapter": 2
    },
    "tags": ["nazgul"]
  },
  {
    "id": "ataque-en-la-cima",
    "date": {
      "year": 3018,
      "month": 10,
      "day": 6
    },
    "placeId": "cima-de-los-vientos",
    "title": "Un cuchillo en la oscuridad",